13:24:49.682256 IP c-24-17-107-51.hsd1.wa.comcast.net.30273 > cdns01.comcast.net.53: 42003+ A? 2.north-america.pool.ntp.org. (46)
13:24:49.682360 IP c-24-17-107-51.hsd1.wa.comcast.net.30273 > cdns02.comcast.net.53: 42003+ A? 2.north-america.pool.ntp.org. (46)
13:24:49.682547 IP6 2001:558:600a:d4:1194:832d:660:fb31.10831 > cdns01.comcast.net.53: 42003+ A? 2.north-america.pool.ntp.org. (46)
13:24:49.682668 IP6 2001:558:600a:d4:1194:832d:660:fb31.10831 > cdns02.comcast.net.53: 42003+ A? 2.north-america.pool.ntp.org. (46)
13:24:49.694317 IP6 2001:558:600a:d4:1194:832d:660:fb31.16258 > cdns01.comcast.net.53: 47668+ A? 2.north-america.pool.ntp.org. (46)
13:24:49.698274 IP cdns01.comcast.net.53 > c-24-17-107-51.hsd1.wa.comcast.net.30273: 42003 4/0/0 A 184.105.182.7, A 198.211.103.209, A 72.14.183.39, A 204.2.134.164 (110)
13:24:49.704292 IP6 cdns01.comcast.net.53 > 2001:558:600a:d4:1194:832d:660:fb31.10831: 42003 4/0/0 A 163.237.218.19, A 216.197.156.83, A 209.115.181.102, A 206.108.0.131 (110)
13:24:49.712350 IP6 cdns01.comcast.net.53 > 2001:558:600a:d4:1194:832d:660:fb31.16258: 47668 4/0/0 A 50.205.244.113, A 108.59.2.24, A 107.175.144.206, A 204.11.201.10 (110)
13:24:49.715318 IP cdns02.comcast.net.53 > c-24-17-107-51.hsd1.wa.comcast.net.30273: 42003 4/0/0 A 45.79.36.123, A 209.141.56.18, A 68.233.45.146, A 162.248.244.243 (110)
13:24:49.721208 IP6 cdns02.comcast.net.53 > 2001:558:600a:d4:1194:832d:660:fb31.10831: 42003 4/0/0 A 172.98.193.44, A 74.6.168.72, A 69.10.161.7, A 68.69.221.61 (110)
13:24:51.898108 IP6 2001:558:600a:d4:1194:832d:660:fb31.48121 > cdns01.comcast.net.53: 63266+ A? waluigi.goguardian.com. (40)
13:24:51.914881 IP6 cdns01.comcast.net.53 > 2001:558:600a:d4:1194:832d:660:fb31.48121: 63266 8/0/0 A 54.185.86.246, A 52.39.133.50, A 35.161.133.38, A 52.89.74.221, A 44.232.51.134, A 35.165.40.88, A 52.39.123.183, A 54.203.32.82 (168)
13:24:52.716788 IP6 2001:558:600a:d4:1194:832d:660:fb31.35168 > cdns01.comcast.net.53: 48734+ A? 0.amazon.pool.ntp.org. (39)
13:24:52.724210 IP6 2001:558:600a:d4:1194:832d:660:fb31.15205 > cdns01.comcast.net.53: 49092+ A? 0.amazon.pool.ntp.org. (39)
13:24:52.731530 IP6 2001:558:600a:d4:1194:832d:660:fb31.12779 > cdns01.comcast.net.53: 35541+ A? 0.amazon.pool.ntp.org. (39)
13:24:52.733469 IP6 cdns01.comcast.net.53 > 2001:558:600a:d4:1194:832d:660:fb31.35168: 48734 4/0/0 A 69.10.161.7, A 69.164.213.136, A 50.205.244.108, A 209.51.161.238 (103)
13:24:52.741838 IP6 cdns01.comcast.net.53 > 2001:558:600a:d4:1194:832d:660:fb31.15205: 49092 4/0/0 A 5.135.3.88, A 195.137.195.250, A 51.79.69.205, A 64.6.144.6 (103)
13:24:52.747788 IP6 cdns01.comcast.net.53 > 2001:558:600a:d4:1194:832d:660:fb31.12779: 35541 4/0/0 A 69.10.161.7, A 69.164.213.136, A 50.205.244.108, A 209.51.161.238 (103)
13:24:55.761749 IP6 2001:558:600a:d4:1194:832d:660:fb31.31176 > cdns01.comcast.net.53: 19682+ A? 1.amazon.pool.ntp.org. (39)
13:24:55.777011 IP6 2001:558:600a:d4:1194:832d:660:fb31.48541 > cdns01.comcast.net.53: 47483+ A? 1.amazon.pool.ntp.org. (39)
